{
  "specversion": "1.0",
  "id": "44444444-4444-4444-8444-444444444444",
  "source": "https://omama.vn/services/shipping-service",
  "type": "vn.omama.shipping.shipment.delivered.v2",
  "subject": "shipment_id:22222222-2222-4222-8222-222222222222",
  "time": "2026-10-26T01:00:00Z",
  "datacontenttype": "application/json",
  "traceparent": "00-11111111111111111111111111111111-2222222222222222-01",
  "data": {
    "shipment_id": "22222222-2222-4222-8222-222222222222",
    "order_id": "11111111-1111-4111-8111-111111111111",
    "package_id": "33333333-3333-4333-8333-333333333333",
    "carrier_code": "FAKE",
    "tracking_code": "FAKE-MVP-001",
    "status": "DELIVERED",
    "resource_version": 3,
    "ready_generation": 1
  }
}
